{"$schema":"https://json-schema.org/draft/2020-12/schema","$id":"https://schedulerlab.local/schemas/m3-experiment-protocol-v1.json","title":"M3 Experiment Protocol","type":"object","required":["schemaVersion","protocolId","seedProtocol","scenarios","loadFractions","loadDefinition","candidateSchedulers","baselinePolicy","latencyPercentiles","nullPolicy","confidenceInterval","practicalImportance","integrityPolicy"],"properties":{"schemaVersion":{"const":1},"protocolId":{"type":"string","minLength":1},"seedProtocol":{"type":"object","required":["developmentSeeds","evaluationSeeds"],"properties":{"developmentSeeds":{"type":"array","minItems":2,"uniqueItems":true,"items":{"type":"integer","minimum":0}},"evaluationSeeds":{"type":"array","minItems":2,"uniqueItems":true,"items":{"type":"integer","minimum":0}}}},"scenarios":{"type":"array","minItems":2,"uniqueItems":true,"items":{"type":"string"}},"loadFractions":{"type":"array","minItems":3,"items":{"type":"number","exclusiveMinimum":0}},"loadDefinition":{"const":"offeredLoadMbps / capacityReferenceMbps"},"candidateSchedulers":{"type":"array","minItems":1,"uniqueItems":true,"items":{"type":"string"}},"currentPrototypeSchedulers":{"type":"array","uniqueItems":true,"items":{"type":"string"}},"baselinePolicy":{"type":"object"},"latencyPercentiles":{"type":"object","required":["method","minimumSampleCountForP99"]},"nullPolicy":{"type":"object"},"confidenceInterval":{"type":"object"},"practicalImportance":{"type":"object"},"integrityPolicy":{"type":"object"}},"additionalProperties":false}
