{"schemaVersion":1,"protocolId":"m3-scientific-algorithm-selection-v1","seedProtocol":{"developmentSeeds":[31001,31002,31003,31004,31005,31006,31007,31008,31009,31010],"evaluationSeeds":[41001,41002,41003,41004,41005,41006,41007,41008,41009,41010,41011,41012,41013,41014,41015,41016,41017,41018,41019,41020,41021,41022,41023,41024,41025,41026,41027,41028,41029,41030]},"scenarios":["sc1-same-qos","sc2-mixed-qos"],"loadFractions":[0.5,0.8,1.1],"loadDefinition":"offeredLoadMbps / capacityReferenceMbps","candidateSchedulers":["proportional-fair","m-lwdf","exp-pf","project-adapted-log-rule","ue-level-adapted-qos-pf","nq-pf"],"currentPrototypeSchedulers":["m-lwdf","exp-pf","qdf-pf"],"baselinePolicy":{"qos":["m-lwdf","exp-pf"],"throughput":"proportional-fair","fairness":["proportional-fair","m-lwdf"]},"latencyPercentiles":{"method":"linear-interpolation-r7","minimumSampleCountForP99":100},"nullPolicy":{"nonApplicableGbr":null,"missingPairwiseDifference":null,"emptyPercentile":null},"confidenceInterval":{"level":0.95,"method":"paired-student-t"},"practicalImportance":{"provisionalProjectThresholds":true,"throughputNonInferiorityLossFractions":[0.03,0.05,0.1],"defaultThroughputNonInferiorityLossFraction":0.05,"jainLossThresholds":[0.01,0.02,0.05],"defaultJainLossThreshold":0.02},"integrityPolicy":{"missingRun":"fail","nonFiniteMetric":"fail","seedRoleOverlap":"fail","fingerprintMismatch":"fail"}}
